{
  "$schema": "https://raw.githubusercontent.com/dp-69/xpm/main/files/xpm.schema.json",
  "image": {
    "path" : "../../images/Est_5phase250cubed4micron.raw",
    "size" : [250, 250, 250],
    "resolution": 4e-6,
    "phase": {
      "void" : 0, 
      "solid" : 4
    }  
  },
  "darcy": [
    {"value": 1, "file": "../../results/Est_Nano_Erode/phi_k_kr_pc.json"},
    {"value": 2, "file": "../../results/Est_Nano/phi_k_kr_pc.json"},
    {"value": 3, "file": "../../results/Est_Nano_Dilate/phi_k_kr_pc.json"}
  ],
  "solver" : {
    "decomposition": [4, 3, 2]
  },
  "report" : {
    "display" : "saturation", 
    "invasion_percolation" : true,
    "capillary_pressure_sw_step": 0.075, 
    "relative_permeability_sw_step": 0.05,
	  "max_capillary_pressure" : 1e7
  }
}
